### ISSUE TITLE
3 way handshake should fail if tcp client is not allowed to connect due to maxConnection threshold limit

### ISSUE THREAD

**Issue by webtunings** [joyent/node#7344]
Problem description:
TCP 3 way handshake should fail if the client is not allowed to connect to server due to maxConnections threshold. I see that 3 way handshake is successful and after that connection is terminated by sending FIN by both ends. tcpdump is mentioned below.

Expected: handshake should fail at the first stage only instead of handshake successful followed by connection termination.

Setup:
TCP server port=33319 with maxConnections=1

Script:
var tcpServer = net.createServer(function(socket){
                socket.on('data', function(data){
                        console.log('data received from the tcp client');
                        });
                });
tcpServer.maxConnections=1;
tcpServer.listen(function(){ 
                var port = tcpServer.address().port;
                console.log('server started listening on port: ' + port);
                });
tcpdump log(for second tcp client)
localhost.52028 > localhost.33319: Flags [S.]
localhost.33319 > localhost.52028: Flags [S.]
localhost.52028 > localhost.33319: Flags [.]
localhost.33319 > localhost.52028: Flags [F.]
localhost.52028 > localhost.33319: Flags [F.]
localhost.33319 > localhost.52028: Flags [.]

**Comment by jasnell** [comment]
Closing per the resolution of https://github.com/nodejs/io.js/issues/1744
